{
  "metrics_id": "ops_metrics.v0.1",
  "ops_id": "ops_config.v0.1",
  "session_count": 0,
  "completion_count": 0,
  "completion_rate": 0,
  "feedback_count": 0,
  "safety_block_count": 0,
  "api_failure_count": 0,
  "realtime_failure_count": 0,
  "share_report_count": 0,
  "critical_event_count": 0
}
